{
  "$schema": "https://json-schema.org/draft/2020-12/schema",
  "$id": "https://jacelber.github.io/mtgo-data/schemas/mtgo-range.schema.json",
  "title": "MTGO range statistics",
  "x-schema-version": "1.1.0",
  "type": "object",
  "required": ["schema_version", "format", "source", "classifier_digest", "period", "total_decks", "total_high_score", "total_top8", "unknown_count", "archetypes"],
  "properties": {
    "schema_version": {"const": "1.1.0"},
    "format": {"$ref": "common.schema.json#/$defs/formatId"},
    "source": {"const": "mtgo"},
    "classifier_digest": {"type": "string", "pattern": "^[a-f0-9]{64}$"},
    "construction_digest": {"type": "string", "pattern": "^[a-f0-9]{64}$"},
    "period": {"$ref": "common.schema.json#/$defs/period"},
    "total_decks": {"type": "integer", "minimum": 0},
    "total_high_score": {"type": "integer", "minimum": 0},
    "total_top8": {"type": "integer", "minimum": 0},
    "unknown_count": {"type": "integer", "minimum": 0},
    "archetypes": {
      "type": "array",
      "items": {
        "type": "object",
        "required": ["name", "count", "high_score_count", "high_score_share", "top8_count", "top8_share", "conversion", "avg_points_per_round", "avg_deviation"],
        "properties": {
          "id": {"type": "string", "minLength": 1},
          "name": {"type": "string", "minLength": 1},
          "count": {"type": "integer", "minimum": 0},
          "high_score_count": {"type": "integer", "minimum": 0},
          "high_score_share": {"type": "number", "minimum": 0, "maximum": 1},
          "top8_count": {"type": "integer", "minimum": 0},
          "top8_share": {"type": "number", "minimum": 0, "maximum": 1},
          "conversion": {"type": ["number", "null"], "minimum": 0, "maximum": 1},
          "avg_points_per_round": {"type": "number", "minimum": 0, "maximum": 3},
          "avg_deviation": {"type": ["number", "null"], "minimum": 0},
          "subtypes": {
            "type": "array",
            "items": {"$ref": "#/$defs/subtypeStatistics"}
          }
        },
        "additionalProperties": false
      }
    }
  },
  "$defs": {
    "subtypeStatistics": {
      "type": "object",
      "required": [
        "id", "parent_id", "name", "display_name", "count", "parent_share",
        "high_score_count", "high_score_share", "top8_count", "top8_share",
        "conversion", "avg_points_per_round", "avg_deviation"
      ],
      "properties": {
        "id": {"type": "string", "minLength": 1},
        "parent_id": {"type": "string", "minLength": 1},
        "name": {"type": "string", "minLength": 1},
        "display_name": {"type": "string", "minLength": 1},
        "count": {"type": "integer", "minimum": 0},
        "parent_share": {"type": "number", "minimum": 0, "maximum": 1},
        "high_score_count": {"type": "integer", "minimum": 0},
        "high_score_share": {"type": ["number", "null"], "minimum": 0, "maximum": 1},
        "top8_count": {"type": "integer", "minimum": 0},
        "top8_share": {"type": ["number", "null"], "minimum": 0, "maximum": 1},
        "conversion": {"type": ["number", "null"], "minimum": 0, "maximum": 1},
        "avg_points_per_round": {"type": ["number", "null"], "minimum": 0, "maximum": 3},
        "avg_deviation": {"type": ["number", "null"], "minimum": 0}
      },
      "additionalProperties": false
    }
  },
  "allOf": [
    {
      "if": {"properties": {"format": {"not": {"const": "standard"}}}, "required": ["format"]},
      "then": {"properties": {"archetypes": {"items": {"required": ["id"]}}}}
    }
  ],
  "additionalProperties": false
}
