{
  "schema_version": "1.1.0",
  "format": "modern",
  "source": "mtgo",
  "classifier_digest": "10be27063f5e73c74d15d358b9ab9bfefa28893f0b0f924ae3b9466a7c00feab",
  "period": {
    "type": "1w",
    "start": "2026-09-07",
    "end": "2026-09-13",
    "weeks": 1
  },
  "total_decks": 412,
  "total_high_score": 362,
  "total_top8": 104,
  "unknown_count": 0,
  "archetypes": [
    {
      "id": "prowess",
      "name": "Prowess",
      "count": 53,
      "high_score_count": 48,
      "high_score_share": 0.1326,
      "top8_count": 16,
      "top8_share": 0.1538,
      "conversion": 0.3333,
      "avg_points_per_round": 1.98,
      "subtypes": [
        {
          "id": "izzet",
          "name": "Izzet",
          "parent_id": "prowess",
          "display_name": "Izzet Prowess",
          "count": 42,
          "high_score_count": 40,
          "high_score_share": 0.1105,
          "top8_count": 13,
          "top8_share": 0.125,
          "conversion": 0.325,
          "avg_points_per_round": 1.99,
          "parent_share": 0.7925,
          "avg_deviation": 17
        },
        {
          "id": "temur",
          "name": "Temur",
          "parent_id": "prowess",
          "display_name": "Temur Prowess",
          "count": 7,
          "high_score_count": 5,
          "high_score_share": 0.0138,
          "top8_count": 3,
          "top8_share": 0.0288,
          "conversion": 0.6,
          "avg_points_per_round": 2.06,
          "parent_share": 0.1321,
          "avg_deviation": 12
        },
        {
          "id": "grixis",
          "name": "Grixis",
          "parent_id": "prowess",
          "display_name": "Grixis Prowess",
          "count": 3,
          "high_score_count": 2,
          "high_score_share": 0.0055,
          "top8_count": 0,
          "top8_share": 0.0,
          "conversion": 0.0,
          "avg_points_per_round": 1.74,
          "parent_share": 0.0566,
          "avg_deviation": null
        },
        {
          "id": "jeskai",
          "name": "Jeskai",
          "parent_id": "prowess",
          "display_name": "Jeskai Prowess",
          "count": 1,
          "high_score_count": 1,
          "high_score_share": 0.0028,
          "top8_count": 0,
          "top8_share": 0.0,
          "conversion": 0.0,
          "avg_points_per_round": 1.71,
          "parent_share": 0.0189,
          "avg_deviation": null
        },
        {
          "id": "lessons",
          "name": "Lessons",
          "parent_id": "prowess",
          "display_name": "Lessons Prowess",
          "count": 0,
          "high_score_count": 0,
          "high_score_share": 0.0,
          "top8_count": 0,
          "top8_share": 0.0,
          "conversion": null,
          "avg_points_per_round": null,
          "parent_share": 0.0,
          "avg_deviation": null
        },
        {
          "id": "boros",
          "name": "Boros",
          "parent_id": "prowess",
          "display_name": "Boros Prowess",
          "count": 0,
          "high_score_count": 0,
          "high_score_share": 0.0,
          "top8_count": 0,
          "top8_share": 0.0,
          "conversion": null,
          "avg_points_per_round": null,
          "parent_share": 0.0,
          "avg_deviation": null
        },
        {
          "id": "mono-red",
          "name": "Mono-Red",
          "parent_id": "prowess",
          "display_name": "Mono-Red Prowess",
          "count": 0,
          "high_score_count": 0,
          "high_score_share": 0.0,
          "top8_count": 0,
          "top8_share": 0.0,
          "conversion": null,
          "avg_points_per_round": null,
          "parent_share": 0.0,
          "avg_deviation": null
        },
        {
          "id": "mardu",
          "name": "Mardu",
          "parent_id": "prowess",
          "display_name": "Mardu Prowess",
          "count": 0,
          "high_score_count": 0,
          "high_score_share": 0.0,
          "top8_count": 0,
          "top8_share": 0.0,
          "conversion": null,
          "avg_points_per_round": null,
          "parent_share": 0.0,
          "avg_deviation": null
        },
        {
          "id": "rakdos",
          "name": "Rakdos",
          "parent_id": "prowess",
          "display_name": "Rakdos Prowess",
          "count": 0,
          "high_score_count": 0,
          "high_score_share": 0.0,
          "top8_count": 0,
          "top8_share": 0.0,
          "conversion": null,
          "avg_points_per_round": null,
          "parent_share": 0.0,
          "avg_deviation": null
        }
      ],
      "avg_deviation": 17
    },
    {
      "id": "broodscale-combo",
      "name": "Broodscale Combo",
      "count": 46,
      "high_score_count": 43,
      "high_score_share": 0.1188,
      "top8_count": 15,
      "top8_share": 0.1442,
      "conversion": 0.3488,
      "avg_points_per_round": 2.13,
      "subtypes": [
        {
          "id": "gruul",
          "name": "Gruul",
          "parent_id": "broodscale-combo",
          "display_name": "Gruul Broodscale Combo",
          "count": 1,
          "high_score_count": 1,
          "high_score_share": 0.0028,
          "top8_count": 0,
          "top8_share": 0.0,
          "conversion": 0.0,
          "avg_points_per_round": 1.71,
          "parent_share": 0.0217,
          "avg_deviation": 20
        },
        {
          "id": "mono-green",
          "name": "Mono-Green",
          "parent_id": "broodscale-combo",
          "display_name": "Mono-Green Broodscale Combo",
          "count": 44,
          "high_score_count": 41,
          "high_score_share": 0.1133,
          "top8_count": 15,
          "top8_share": 0.1442,
          "conversion": 0.3659,
          "avg_points_per_round": 2.14,
          "parent_share": 0.9565,
          "avg_deviation": 14
        },
        {
          "id": "golgari",
          "name": "Golgari",
          "parent_id": "broodscale-combo",
          "display_name": "Golgari Broodscale Combo",
          "count": 1,
          "high_score_count": 1,
          "high_score_share": 0.0028,
          "top8_count": 0,
          "top8_share": 0.0,
          "conversion": 0.0,
          "avg_points_per_round": 2.14,
          "parent_share": 0.0217,
          "avg_deviation": null
        },
        {
          "id": "simic",
          "name": "Simic",
          "parent_id": "broodscale-combo",
          "display_name": "Simic Broodscale Combo",
          "count": 0,
          "high_score_count": 0,
          "high_score_share": 0.0,
          "top8_count": 0,
          "top8_share": 0.0,
          "conversion": null,
          "avg_points_per_round": null,
          "parent_share": 0.0,
          "avg_deviation": null
        }
      ],
      "avg_deviation": 16
    },
    {
      "id": "esper-blink",
      "name": "Esper Blink",
      "count": 28,
      "high_score_count": 23,
      "high_score_share": 0.0635,
      "top8_count": 10,
      "top8_share": 0.0962,
      "conversion": 0.4348,
      "avg_points_per_round": 2.05,
      "avg_deviation": 5
    },
    {
      "id": "dimir-tempo",
      "name": "Dimir Tempo",
      "count": 24,
      "high_score_count": 20,
      "high_score_share": 0.0552,
      "top8_count": 3,
      "top8_share": 0.0288,
      "conversion": 0.15,
      "avg_points_per_round": 1.83,
      "subtypes": [
        {
          "id": "dimir",
          "name": "Dimir",
          "parent_id": "dimir-tempo",
          "display_name": "Dimir Tempo",
          "count": 21,
          "high_score_count": 17,
          "high_score_share": 0.047,
          "top8_count": 3,
          "top8_share": 0.0288,
          "conversion": 0.1765,
          "avg_points_per_round": 1.83,
          "parent_share": 0.875,
          "avg_deviation": 40
        },
        {
          "id": "grixis",
          "name": "Dimir Red Splash",
          "parent_id": "dimir-tempo",
          "display_name": "Dimir Red Splash Tempo",
          "count": 2,
          "high_score_count": 2,
          "high_score_share": 0.0055,
          "top8_count": 0,
          "top8_share": 0.0,
          "conversion": 0.0,
          "avg_points_per_round": 1.93,
          "parent_share": 0.0833,
          "avg_deviation": 49
        },
        {
          "id": "esper",
          "name": "Dimir White Splash",
          "parent_id": "dimir-tempo",
          "display_name": "Dimir White Splash Tempo",
          "count": 1,
          "high_score_count": 1,
          "high_score_share": 0.0028,
          "top8_count": 0,
          "top8_share": 0.0,
          "conversion": 0.0,
          "avg_points_per_round": 1.71,
          "parent_share": 0.0417,
          "avg_deviation": null
        }
      ],
      "avg_deviation": 42
    },
    {
      "id": "esper-goryos",
      "name": "Esper Goryo's",
      "count": 23,
      "high_score_count": 21,
      "high_score_share": 0.058,
      "top8_count": 4,
      "top8_share": 0.0385,
      "conversion": 0.1905,
      "avg_points_per_round": 1.98,
      "avg_deviation": 10
    },
    {
      "id": "devoted-druid-combo",
      "name": "Devoted Druid Combo",
      "count": 20,
      "high_score_count": 18,
      "high_score_share": 0.0497,
      "top8_count": 5,
      "top8_share": 0.0481,
      "conversion": 0.2778,
      "avg_points_per_round": 1.91,
      "subtypes": [
        {
          "id": "abzan",
          "name": "Abzan",
          "parent_id": "devoted-druid-combo",
          "display_name": "Abzan Devoted Druid Combo",
          "count": 20,
          "high_score_count": 18,
          "high_score_share": 0.0497,
          "top8_count": 5,
          "top8_share": 0.0481,
          "conversion": 0.2778,
          "avg_points_per_round": 1.91,
          "parent_share": 1.0,
          "avg_deviation": 12
        },
        {
          "id": "selesnya",
          "name": "Selesnya",
          "parent_id": "devoted-druid-combo",
          "display_name": "Selesnya Devoted Druid Combo",
          "count": 0,